{
  "all_other_baseline_paths_byte_preserved": true,
  "artifact_id": "V0_OSAP_GATE3_CLUSTER_B_WP4_PRESERVATION_FIREWALL",
  "authorized_modified_paths": [
    "coq/_CoqProject",
    "coq/theories/Theorems.v",
    "lean/V0OSAP.lean",
    "lean/V0OSAP/Theorems.lean"
  ],
  "authorized_post_sha256": {
    "coq/_CoqProject": "476abaf801f06377b859aa2e4b0b3bc07f059a9085221a714f7073885b8b26dd",
    "coq/theories/Theorems.v": "8d5453e077179e3401c3f51ebeecc864ef81eaf275398c536ab303cf5e994883",
    "lean/V0OSAP.lean": "696a1b85fb78518d6826c2efbca6a21f8f9707454fa6367020a8db8c4bd246f0",
    "lean/V0OSAP/Theorems.lean": "65302fd57502cfaa89bb71644e35c10d23b31d5a20a3d5bc63e7b9e1bece799e"
  },
  "authorized_pre_sha256": {
    "coq/_CoqProject": "14654d8194a06cf460cdba6b2ade125c8c63488dd35eddf68e6325e7b8cedbaa",
    "coq/theories/Theorems.v": "6fb52e2ee838190398cd53ce820a11cea199ebcefc39512670c2de43a40fc5b5",
    "lean/V0OSAP.lean": "3d41f76ed4ba28dca11c3454e86b35f7a0f6c6cdbaa6116af43609d4ef9201f5",
    "lean/V0OSAP/Theorems.lean": "e9c6ca2b998b6af095ea0b0ae31c9b6b8b1a61f914e9c04a32db39d1c69cc290"
  },
  "baseline": "c90041d3da5b680b574b910de50d8769d32fbfa9",
  "canonical_ledgers_modification_authorized": false,
  "canonical_records_modification_authorized": false,
  "date": "2026-07-23",
  "frozen_work_packages": [
    "WP0",
    "WP1",
    "WP2",
    "WP3"
  ],
  "policy": "ADDITIVE_WP4_WITH_EXACT_HASH_GUARDED_BACKEND_AGGREGATION_IMPORTS",
  "release_actions_authorized": false,
  "rollback_on_any_failure": true,
  "theorem_identity_modification_authorized": false,
  "version": "0.1"
}
